{
  "kind": "repora.repository-assessment",
  "version": 1,
  "id": "replace-me",
  "title": "Repository assessment",
  "scope": ["quality"],
  "summary": "TODO: summarize the assessment scope and outcome.",
  "snapshot": {
    "kind": "repora.repository-snapshot",
    "version": 1,
    "repository": {"full_name": "owner/repository"},
    "revision": {"commit": "0000000", "dirty": false},
    "captured_at": "1970-01-01T00:00:00Z"
  },
  "findings": [],
  "evidence": [],
  "scorecard": {
    "kind": "repora.scorecard",
    "version": 1,
    "dimensions": [
      {
        "name": "documentation",
        "score": 0,
        "rationale": "TODO: replace this placeholder dimension or provide evidence-backed rationale.",
        "evidence_ids": []
      }
    ]
  },
  "metadata": {
    "created_by": "template",
    "created_at": "1970-01-01T00:00:00Z",
    "notes": "Template only. Replace placeholder snapshot, scope, scorecard, findings, and evidence before treating this as an assessment."
  }
}
